{
  "version": "1.0.0",
  "description": "Chronos Memory Reproducible Evaluation Benchmark Dataset. Structured for expansion from 35 to 150+ scenarios.",
  "target_total_capacity": 150,
  "scenarios": [
    {
      "scenario_id": "scen_001",
      "category": "software_stacks",
      "title": "Backend Framework Migration",
      "description": "User transitions from Flask to FastAPI with explicit contradiction resolution.",
      "difficulty": "standard",
      "episode_sequence": [
        {
          "session_id": "sess_001",
          "speaker": "User",
          "text": "My backend framework is Flask.",
          "timestamp": "2022-01-15T10:00:00Z"
        },
        {
          "session_id": "sess_001",
          "speaker": "User",
          "text": "I switched my backend framework to FastAPI.",
          "timestamp": "2024-03-01T14:30:00Z"
        }
      ],
      "expected_active_facts": [
        { "subject": "User", "predicate": "backend_framework", "object": "FastAPI" }
      ],
      "expected_historical_facts": [
        { "subject": "User", "predicate": "backend_framework", "object": "Flask" }
      ],
      "expected_contradictions": 1,
      "expected_test_queries": [
        {
          "query": "What backend framework do I use now?",
          "target_temporal_state": "current",
          "expected_keywords": ["FastAPI"],
          "forbidden_keywords": ["Flask is your current"]
        },
        {
          "query": "What framework did I use before?",
          "target_temporal_state": "historical",
          "expected_keywords": ["Flask"],
          "forbidden_keywords": ["FastAPI is what you used before"]
        }
      ]
    },
    {
      "scenario_id": "scen_002",
      "category": "software_stacks",
      "title": "Database Architecture Migration",
      "description": "Primary operational database migration from PostgreSQL to DynamoDB.",
      "difficulty": "standard",
      "episode_sequence": [
        {
          "session_id": "sess_002",
          "speaker": "User",
          "text": "We store our core application data in PostgreSQL.",
          "timestamp": "2021-06-10T09:00:00Z"
        },
        {
          "session_id": "sess_002",
          "speaker": "User",
          "text": "We migrated our database from PostgreSQL to DynamoDB for serverless scaling.",
          "timestamp": "2023-11-20T16:00:00Z"
        }
      ],
      "expected_active_facts": [
        { "subject": "User", "predicate": "database", "object": "DynamoDB" }
      ],
      "expected_historical_facts": [
        { "subject": "User", "predicate": "database", "object": "PostgreSQL" }
      ],
      "expected_contradictions": 1,
      "expected_test_queries": [
        {
          "query": "What database do we use now?",
          "target_temporal_state": "current",
          "expected_keywords": ["DynamoDB"],
          "forbidden_keywords": ["PostgreSQL is current"]
        },
        {
          "query": "What database did we use previously?",
          "target_temporal_state": "historical",
          "expected_keywords": ["PostgreSQL"],
          "forbidden_keywords": []
        }
      ]
    },
    {
      "scenario_id": "scen_003",
      "category": "software_stacks",
      "title": "Frontend Framework Evolution",
      "description": "User updates frontend from Vue.js to Next.js.",
      "difficulty": "standard",
      "episode_sequence": [
        {
          "session_id": "sess_003",
          "speaker": "User",
          "text": "Our web application frontend is built with Vue.js.",
          "timestamp": "2022-04-01T11:00:00Z"
        },
        {
          "session_id": "sess_003",
          "speaker": "User",
          "text": "We recently transitioned our frontend stack to Next.js.",
          "timestamp": "2024-05-12T10:15:00Z"
        }
      ],
      "expected_active_facts": [
        { "subject": "User", "predicate": "frontend_framework", "object": "Next.js" }
      ],
      "expected_historical_facts": [
        { "subject": "User", "predicate": "frontend_framework", "object": "Vue.js" }
      ],
      "expected_contradictions": 1,
      "expected_test_queries": [
        {
          "query": "What frontend framework do we use now?",
          "target_temporal_state": "current",
          "expected_keywords": ["Next.js"],
          "forbidden_keywords": ["Vue.js is your current"]
        }
      ]
    },
    {
      "scenario_id": "scen_004",
      "category": "software_stacks",
      "title": "Cloud Provider Switch",
      "description": "Enterprise cloud platform transition from AWS to Google Cloud.",
      "difficulty": "standard",
      "episode_sequence": [
        {
          "session_id": "sess_004",
          "speaker": "User",
          "text": "All our microservices run on AWS.",
          "timestamp": "2020-08-15T08:00:00Z"
        },
        {
          "session_id": "sess_004",
          "speaker": "User",
          "text": "We moved all infrastructure from AWS to Google Cloud.",
          "timestamp": "2023-09-01T12:00:00Z"
        }
      ],
      "expected_active_facts": [
        { "subject": "User", "predicate": "cloud_provider", "object": "Google Cloud" }
      ],
      "expected_historical_facts": [
        { "subject": "User", "predicate": "cloud_provider", "object": "AWS" }
      ],
      "expected_contradictions": 1,
      "expected_test_queries": [
        {
          "query": "What cloud provider do we run on now?",
          "target_temporal_state": "current",
          "expected_keywords": ["Google Cloud"],
          "forbidden_keywords": ["AWS is your current"]
        }
      ]
    },
    {
      "scenario_id": "scen_005",
      "category": "software_stacks",
      "title": "Primary Language Modernization",
      "description": "Modernizing Android development language from Java to Kotlin.",
      "difficulty": "standard",
      "episode_sequence": [
        {
          "session_id": "sess_005",
          "speaker": "User",
          "text": "I write my Android applications in Java.",
          "timestamp": "2019-03-10T10:00:00Z"
        },
        {
          "session_id": "sess_005",
          "speaker": "User",
          "text": "I switched my primary Android language to Kotlin.",
          "timestamp": "2022-07-20T15:30:00Z"
        }
      ],
      "expected_active_facts": [
        { "subject": "User", "predicate": "primary_language", "object": "Kotlin" }
      ],
      "expected_historical_facts": [
        { "subject": "User", "predicate": "primary_language", "object": "Java" }
      ],
      "expected_contradictions": 1,
      "expected_test_queries": [
        {
          "query": "What language do I write Android apps in now?",
          "target_temporal_state": "current",
          "expected_keywords": ["Kotlin"],
          "forbidden_keywords": ["Java is current"]
        }
      ]
    },
    {
      "scenario_id": "scen_006",
      "category": "location_changes",
      "title": "International Relocation",
      "description": "Alice moves from Seattle to London.",
      "difficulty": "standard",
      "episode_sequence": [
        {
          "session_id": "sess_006",
          "speaker": "User",
          "text": "Alice moved to Seattle in 2020.",
          "timestamp": "2020-02-01T10:00:00Z"
        },
        {
          "session_id": "sess_006",
          "speaker": "User",
          "text": "Alice moved to London in 2023.",
          "timestamp": "2023-04-15T14:00:00Z"
        }
      ],
      "expected_active_facts": [
        { "subject": "Alice", "predicate": "lives_in", "object": "London" }
      ],
      "expected_historical_facts": [
        { "subject": "Alice", "predicate": "lives_in", "object": "Seattle" }
      ],
      "expected_contradictions": 1,
      "expected_test_queries": [
        {
          "query": "Where does Alice live now?",
          "target_temporal_state": "current",
          "expected_keywords": ["London"],
          "forbidden_keywords": ["Seattle is where Alice lives now"]
        },
        {
          "query": "Where did Alice live previously?",
          "target_temporal_state": "historical",
          "expected_keywords": ["Seattle"],
          "forbidden_keywords": ["London is where Alice lived previously"]
        }
      ]
    },
    {
      "scenario_id": "scen_007",
      "category": "location_changes",
      "title": "Multi-Hop Global Relocation",
      "description": "Bob moves across three cities: New York -> Berlin -> Tokyo.",
      "difficulty": "complex",
      "episode_sequence": [
        {
          "session_id": "sess_007",
          "speaker": "User",
          "text": "Bob lived in New York.",
          "timestamp": "2018-05-01T10:00:00Z"
        },
        {
          "session_id": "sess_007",
          "speaker": "User",
          "text": "Bob moved to Berlin in 2021.",
          "timestamp": "2021-08-10T11:00:00Z"
        },
        {
          "session_id": "sess_007",
          "speaker": "User",
          "text": "Bob moved to Tokyo in 2024.",
          "timestamp": "2024-02-15T09:30:00Z"
        }
      ],
      "expected_active_facts": [
        { "subject": "Bob", "predicate": "lives_in", "object": "Tokyo" }
      ],
      "expected_historical_facts": [
        { "subject": "Bob", "predicate": "lives_in", "object": "New York" },
        { "subject": "Bob", "predicate": "lives_in", "object": "Berlin" }
      ],
      "expected_contradictions": 2,
      "expected_test_queries": [
        {
          "query": "Where does Bob live now?",
          "target_temporal_state": "current",
          "expected_keywords": ["Tokyo"],
          "forbidden_keywords": ["Berlin is current", "New York is current"]
        },
        {
          "query": "Show the history of where Bob lived.",
          "target_temporal_state": "evolution",
          "expected_keywords": ["New York", "Berlin", "Tokyo"],
          "forbidden_keywords": []
        }
      ]
    },
    {
      "scenario_id": "scen_008",